{
  "schema": 1,
  "id": 1,
  "title": "Book flights",
  "priority": -2,
  "created_at": "2026-09-20T18:31:51Z",
  "completed_at": null,
  "updated_at": "2026-09-21T10:15:00Z",
  "blocked_by": [],
  "tags": [
    "travel",
    "urgent"
  ],
  "extra": {
    "status": "waiting",
    "status ": "repeated-looking",
    "ratio": 1.10,
    "big": 12345678901234567890,
    "exp": 1E+2,
    "nested": {
      "list": [
        0.5,
        "héllo ✓ <&>/",
        null
      ],
      "a": {}
    },
    "empty": []
  }
}
